<?xml version="1.0" encoding="UTF-8"?>
<PRODUCTS_LIST xmlns:xsi="http://www.w3.org/2001/XMLSchema-instance" xsi:noNamespaceSchemaLocation="PROSchema.xsd">
  <FILENAME>ASD12P0202201234</FILENAME>
  <MANUFACTURER_CODE>AS1</MANUFACTURER_CODE>
  <PRODUCT>
    <PRODUCT_TYPE>F</PRODUCT_TYPE>
    <GTIN>12345678901234</GTIN>
    <PRODUCT_NAME>PRODUCT NAME</PRODUCT_NAME>
    <GENERIC_NAME>GENERIC NAME</GENERIC_NAME>
    <COMPOSITION>COMPOSITION 1243</COMPOSITION>
    <SCHEDULED>Y</SCHEDULED>
    <REMARK>REMARK sdy</REMARK>
    <STORAGE_CONDITION>20</STORAGE_CONDITION>
    <STRENGTH>STRENGTH</STRENGTH>
    <DOSAGE>DOSAGE</DOSAGE>
    <HS_CODE>12345678</HS_CODE>
  </PRODUCT>
</PRODUCTS_LIST>
